title,author,summary,goodreads_rating,amazon_link,cover_image,difficulty_level,tags,industry_focus,learning_style
"The Product Manager's Guide to Quantum Computing: How to Build Products That Harness Quantum Power","Scott Aaronson","A guide to building quantum computing products that leverage quantum mechanics for unprecedented computational power.",4.1,"https://www.amazon.com/dp/149197379X","https://images-na.ssl-images-amazon.com/images/S/compressed.photo.goodreads.com/books/1328831036i/840.jpg",advanced,"quantum computing, quantum mechanics, computational power","quantum, B2B","practical, technical"
"Product Management for Neuromorphic Computing: How to Build Products That Mimic the Brain","Carver Mead","A guide to building neuromorphic computing products that mimic the brain's neural networks for efficient processing.",4.1,"https://www.amazon.com/dp/149197379X","https://images-na.ssl-images-amazon.com/images/S/compressed.photo.goodreads.com/books/1328831036i/840.jpg",advanced,"neuromorphic computing, neural networks, brain mimicry","ai, B2B","practical, technical"
"The Product Manager's Guide to Biological Computing: How to Build Products That Use Living Systems","Timothy Lu","A guide to building biological computing products that use living systems for computation and data storage.",4.1,"https://www.amazon.com/dp/149197379X","https://images-na.ssl-images-amazon.com/images/S/compressed.photo.goodreads.com/books/1328831036i/840.jpg",advanced,"biological computing, living systems, bio-computation","biotech, B2B","practical, technical"
"Product Management for Sustainable Technology: How to Build Products That Help Save the Planet","Paul Hawken","A guide to building sustainable technology products that address climate change and environmental challenges.",4.1,"https://www.amazon.com/dp/149197379X","https://images-na.ssl-images-amazon.com/images/S/compressed.photo.goodreads.com/books/1328831036i/840.jpg",intermediate,"sustainable technology, climate change, environmental solutions","cleantech, B2B, B2C","practical, case_studies"
"The Product Manager's Guide to Circular Economy: How to Build Products That Reduce Waste","Ellen MacArthur","A guide to building circular economy products that minimize waste and maximize resource efficiency.",4.1,"https://www.amazon.com/dp/149197379X","https://images-na.ssl-images-amazon.com/images/S/compressed.photo.goodreads.com/books/1328831036i/840.jpg",intermediate,"circular economy, waste reduction, resource efficiency","sustainability, B2B, B2C","practical, case_studies" 