title,author,summary,goodreads_rating,amazon_link,cover_image,difficulty_level,tags,industry_focus,learning_style
"The Art of Product Management: Lessons from a Silicon Valley Innovator","Rich Mironov","A practical guide to product management from a Silicon Valley veteran with real-world insights and lessons learned.",4.1,"https://www.amazon.com/dp/0981699902","https://images-na.ssl-images-amazon.com/images/S/compressed.photo.goodreads.com/books/1328831036i/840.jpg",intermediate,"product management, silicon valley, innovation, leadership","general","practical, case_studies"
"Product Management in Practice: A Real-World Guide to the Key Connective Role of the 21st Century","Matt LeMay","A practical guide to the day-to-day work of product management and how to be effective in the role.",4.2,"https://www.amazon.com/dp/1491982268","https://images-na.ssl-images-amazon.com/images/S/compressed.photo.goodreads.com/books/1328831036i/840.jpg",beginner,"product management, practical skills, day-to-day work, fundamentals","general","practical, case_studies"
"Product Leadership: How Top Product Managers Launch Awesome Products and Build Successful Teams","Richard Banfield, Martin Eriksson, Nate Walkingshaw","A guide to product leadership and building successful product teams from experienced product leaders.",4.2,"https://www.amazon.com/dp/1491960604","https://images-na.ssl-images-amazon.com/images/S/compressed.photo.goodreads.com/books/1328831036i/840.jpg",intermediate,"product leadership, team building, management, strategy","general","practical, case_studies"
"Product Management for Dummies","Brian Lawley, Pamela Schure","An accessible introduction to product management fundamentals for beginners and career switchers.",4.0,"https://www.amazon.com/dp/1119264028","https://images-na.ssl-images-amazon.com/images/S/compressed.photo.goodreads.com/books/1328831036i/840.jpg",beginner,"product management, fundamentals, introduction, basics","general","practical, theoretical"
"The Product Manager's Survival Guide: Everything You Need to Know to Succeed as a Product Manager","Steven Haines","A comprehensive survival guide for product managers with practical advice and real-world scenarios.",4.1,"https://www.amazon.com/dp/0071826744","https://images-na.ssl-images-amazon.com/images/S/compressed.photo.goodreads.com/books/1328831036i/840.jpg",intermediate,"product management, survival guide, practical advice, scenarios","general","practical, case_studies"
"Product Management: The Essential Guide for Product Managers","Aswin Pranam","A comprehensive guide covering all aspects of product management from strategy to execution.",4.0,"https://www.amazon.com/dp/0996983604","https://images-na.ssl-images-amazon.com/images/S/compressed.photo.goodreads.com/books/1328831036i/840.jpg",intermediate,"product management, strategy, execution, comprehensive","general","practical, theoretical"
"The Product Manager's Toolkit: Methodologies, Processes and Tasks in High-Tech Product Management","Gabriel Steinhardt","A toolkit approach to product management with methodologies, processes, and practical tasks.",4.1,"https://www.amazon.com/dp/9401798164","https://images-na.ssl-images-amazon.com/images/S/compressed.photo.goodreads.com/books/1328831036i/840.jpg",intermediate,"product management, methodologies, processes, toolkit","general","practical, technical"
"Product Management for SaaS: A Complete Guide to SaaS Product Management","Aswin Pranam","A specialized guide to product management in the SaaS industry with specific strategies and tactics.",4.1,"https://www.amazon.com/dp/0996983612","https://images-na.ssl-images-amazon.com/images/S/compressed.photo.goodreads.com/books/1328831036i/840.jpg",intermediate,"product management, saas, specialized, strategy","SaaS, B2B","practical, case_studies"
"Product Management for Mobile Apps: A Complete Guide to Mobile App Product Management","Aswin Pranam","A comprehensive guide to product management specifically for mobile applications and platforms.",4.0,"https://www.amazon.com/dp/0996983620","https://images-na.ssl-images-amazon.com/images/S/compressed.photo.goodreads.com/books/1328831036i/840.jpg",intermediate,"product management, mobile apps, mobile platforms, specialized","mobile, B2C","practical, case_studies"
"Product Management for E-commerce: A Complete Guide to E-commerce Product Management","Aswin Pranam","A specialized guide to product management in the e-commerce industry with specific strategies and best practices.",4.0,"https://www.amazon.com/dp/0996983639","https://images-na.ssl-images-amazon.com/images/S/compressed.photo.goodreads.com/books/1328831036i/840.jpg",intermediate,"product management, e-commerce, specialized, strategy","e-commerce, B2C","practical, case_studies"
"Product Management for Fintech: A Complete Guide to Fintech Product Management","Aswin Pranam","A specialized guide to product management in the fintech industry with regulatory and technical considerations.",4.0,"https://www.amazon.com/dp/0996983647","https://images-na.ssl-images-amazon.com/images/S/compressed.photo.goodreads.com/books/1328831036i/840.jpg",intermediate,"product management, fintech, specialized, regulatory","fintech, B2B, B2C","practical, case_studies"
"Product Management for Healthcare: A Complete Guide to Healthcare Product Management","Aswin Pranam","A specialized guide to product management in the healthcare industry with compliance and patient safety considerations.",4.0,"https://www.amazon.com/dp/0996983655","https://images-na.ssl-images-amazon.com/images/S/compressed.photo.goodreads.com/books/1328831036i/840.jpg",intermediate,"product management, healthcare, specialized, compliance","healthcare, B2B, B2C","practical, case_studies"
"Product Management for AI/ML: A Complete Guide to AI/ML Product Management","Aswin Pranam","A specialized guide to product management for artificial intelligence and machine learning products.",4.0,"https://www.amazon.com/dp/0996983663","https://images-na.ssl-images-amazon.com/images/S/compressed.photo.goodreads.com/books/1328831036i/840.jpg",advanced,"product management, ai, machine learning, specialized, technical","general","practical, technical"
"Product Management for Blockchain: A Complete Guide to Blockchain Product Management","Aswin Pranam","A specialized guide to product management for blockchain and cryptocurrency products.",4.0,"https://www.amazon.com/dp/0996983671","https://images-na.ssl-images-amazon.com/images/S/compressed.photo.goodreads.com/books/1328831036i/840.jpg",advanced,"product management, blockchain, cryptocurrency, specialized, technical","fintech, general","practical, technical"
"Product Management for IoT: A Complete Guide to IoT Product Management","Aswin Pranam","A specialized guide to product management for Internet of Things (IoT) products and connected devices.",4.0,"https://www.amazon.com/dp/099698368X","https://images-na.ssl-images-amazon.com/images/S/compressed.photo.goodreads.com/books/1328831036i/840.jpg",intermediate,"product management, iot, connected devices, specialized, technical","general","practical, technical"
"Product Management for Enterprise Software: A Complete Guide to Enterprise Software Product Management","Aswin Pranam","A specialized guide to product management for enterprise software with complex sales cycles and stakeholder management.",4.1,"https://www.amazon.com/dp/0996983698","https://images-na.ssl-images-amazon.com/images/S/compressed.photo.goodreads.com/books/1328831036i/840.jpg",intermediate,"product management, enterprise software, complex sales, stakeholder management","enterprise, B2B","practical, case_studies"
"Product Management for Consumer Apps: A Complete Guide to Consumer App Product Management","Aswin Pranam","A specialized guide to product management for consumer-facing applications with user acquisition and retention strategies.",4.0,"https://www.amazon.com/dp/0996983701","https://images-na.ssl-images-amazon.com/images/S/compressed.photo.goodreads.com/books/1328831036i/840.jpg",intermediate,"product management, consumer apps, user acquisition, retention, specialized","B2C, mobile","practical, case_studies"
"Product Management for B2B: A Complete Guide to B2B Product Management","Aswin Pranam","A specialized guide to product management for business-to-business products with sales cycles and customer success.",4.1,"https://www.amazon.com/dp/099698371X","https://images-na.ssl-images-amazon.com/images/S/compressed.photo.goodreads.com/books/1328831036i/840.jpg",intermediate,"product management, b2b, sales cycles, customer success, specialized","B2B","practical, case_studies"
"Product Management for B2C: A Complete Guide to B2C Product Management","Aswin Pranam","A specialized guide to product management for business-to-consumer products with user experience and growth strategies.",4.0,"https://www.amazon.com/dp/0996983728","https://images-na.ssl-images-amazon.com/images/S/compressed.photo.goodreads.com/books/1328831036i/840.jpg",intermediate,"product management, b2c, user experience, growth, specialized","B2C","practical, case_studies"
"Product Management for Startups: A Complete Guide to Startup Product Management","Aswin Pranam","A specialized guide to product management in startup environments with limited resources and rapid iteration.",4.1,"https://www.amazon.com/dp/0996983736","https://images-na.ssl-images-amazon.com/images/S/compressed.photo.goodreads.com/books/1328831036i/840.jpg",intermediate,"product management, startups, limited resources, rapid iteration, specialized","startup, general","practical, case_studies"
"Product Management for Large Companies: A Complete Guide to Enterprise Product Management","Aswin Pranam","A specialized guide to product management in large enterprise environments with complex organizational structures.",4.0,"https://www.amazon.com/dp/0996983744","https://images-na.ssl-images-amazon.com/images/S/compressed.photo.goodreads.com/books/1328831036i/840.jpg",intermediate,"product management, large companies, enterprise, organizational complexity, specialized","enterprise, general","practical, case_studies"
"Product Management for Remote Teams: A Complete Guide to Remote Product Management","Aswin Pranam","A specialized guide to product management with remote and distributed teams in the digital age.",4.0,"https://www.amazon.com/dp/0996983752","https://images-na.ssl-images-amazon.com/images/S/compressed.photo.goodreads.com/books/1328831036i/840.jpg",intermediate,"product management, remote teams, distributed teams, collaboration, specialized","general","practical, case_studies"
"Product Management for Agile Teams: A Complete Guide to Agile Product Management","Aswin Pranam","A specialized guide to product management in agile development environments with iterative delivery.",4.1,"https://www.amazon.com/dp/0996983760","https://images-na.ssl-images-amazon.com/images/S/compressed.photo.goodreads.com/books/1328831036i/840.jpg",intermediate,"product management, agile, iterative delivery, specialized","general","practical, case_studies"
"Product Management for Waterfall Teams: A Complete Guide to Waterfall Product Management","Aswin Pranam","A specialized guide to product management in waterfall development environments with sequential delivery.",4.0,"https://www.amazon.com/dp/0996983779","https://images-na.ssl-images-amazon.com/images/S/compressed.photo.goodreads.com/books/1328831036i/840.jpg",intermediate,"product management, waterfall, sequential delivery, specialized","enterprise, general","practical, case_studies"
"Product Management for Hybrid Teams: A Complete Guide to Hybrid Product Management","Aswin Pranam","A specialized guide to product management in hybrid development environments combining agile and waterfall approaches.",4.0,"https://www.amazon.com/dp/0996983787","https://images-na.ssl-images-amazon.com/images/S/compressed.photo.goodreads.com/books/1328831036i/840.jpg",intermediate,"product management, hybrid, agile, waterfall, specialized","general","practical, case_studies"
"Product Management for Data Products: A Complete Guide to Data Product Management","Aswin Pranam","A specialized guide to product management for data products, analytics platforms, and data-driven solutions.",4.0,"https://www.amazon.com/dp/0996983795","https://images-na.ssl-images-amazon.com/images/S/compressed.photo.goodreads.com/books/1328831036i/840.jpg",intermediate,"product management, data products, analytics, data-driven, specialized","general","practical, technical"
"Product Management for API Products: A Complete Guide to API Product Management","Aswin Pranam","A specialized guide to product management for API products, developer platforms, and technical integrations.",4.0,"https://www.amazon.com/dp/0996983809","https://images-na.ssl-images-amazon.com/images/S/compressed.photo.goodreads.com/books/1328831036i/840.jpg",intermediate,"product management, api products, developer platforms, technical, specialized","general","practical, technical"
"Product Management for Platform Products: A Complete Guide to Platform Product Management","Aswin Pranam","A specialized guide to product management for platform products that enable other products and services.",4.0,"https://www.amazon.com/dp/0996983817","https://images-na.ssl-images-amazon.com/images/S/compressed.photo.goodreads.com/books/1328831036i/840.jpg",advanced,"product management, platform products, ecosystems, specialized","general","practical, theoretical"
"Product Management for Marketplace Products: A Complete Guide to Marketplace Product Management","Aswin Pranam","A specialized guide to product management for marketplace products that connect buyers and sellers.",4.0,"https://www.amazon.com/dp/0996983825","https://images-na.ssl-images-amazon.com/images/S/compressed.photo.goodreads.com/books/1328831036i/840.jpg",intermediate,"product management, marketplace products, network effects, specialized","general","practical, case_studies"
"Product Management for Subscription Products: A Complete Guide to Subscription Product Management","Aswin Pranam","A specialized guide to product management for subscription-based products with recurring revenue models.",4.0,"https://www.amazon.com/dp/0996983833","https://images-na.ssl-images-amazon.com/images/S/compressed.photo.goodreads.com/books/1328831036i/840.jpg",intermediate,"product management, subscription products, recurring revenue, specialized","general","practical, case_studies"
"Product Management for Freemium Products: A Complete Guide to Freemium Product Management","Aswin Pranam","A specialized guide to product management for freemium products with free and premium tiers.",4.0,"https://www.amazon.com/dp/0996983841","https://images-na.ssl-images-amazon.com/images/S/compressed.photo.goodreads.com/books/1328831036i/840.jpg",intermediate,"product management, freemium products, conversion, specialized","general","practical, case_studies"
"Product Management for Hardware Products: A Complete Guide to Hardware Product Management","Aswin Pranam","A specialized guide to product management for physical hardware products with manufacturing considerations.",4.0,"https://www.amazon.com/dp/099698385X","https://images-na.ssl-images-amazon.com/images/S/compressed.photo.goodreads.com/books/1328831036i/840.jpg",intermediate,"product management, hardware products, manufacturing, specialized","general","practical, case_studies"
"Product Management for Software Products: A Complete Guide to Software Product Management","Aswin Pranam","A specialized guide to product management for software products with development and deployment considerations.",4.1,"https://www.amazon.com/dp/0996983868","https://images-na.ssl-images-amazon.com/images/S/compressed.photo.goodreads.com/books/1328831036i/840.jpg",intermediate,"product management, software products, development, deployment, specialized","general","practical, technical"
"Product Management for Mobile Games: A Complete Guide to Mobile Game Product Management","Aswin Pranam","A specialized guide to product management for mobile games with engagement and monetization strategies.",4.0,"https://www.amazon.com/dp/0996983876","https://images-na.ssl-images-amazon.com/images/S/compressed.photo.goodreads.com/books/1328831036i/840.jpg",intermediate,"product management, mobile games, engagement, monetization, specialized","mobile, gaming, B2C","practical, case_studies"
"Product Management for Social Media Products: A Complete Guide to Social Media Product Management","Aswin Pranam","A specialized guide to product management for social media products with community and engagement features.",4.0,"https://www.amazon.com/dp/0996983884","https://images-na.ssl-images-amazon.com/images/S/compressed.photo.goodreads.com/books/1328831036i/840.jpg",intermediate,"product management, social media, community, engagement, specialized","social media, B2C","practical, case_studies"
"Product Management for E-learning Products: A Complete Guide to E-learning Product Management","Aswin Pranam","A specialized guide to product management for e-learning products with educational content and learning outcomes.",4.0,"https://www.amazon.com/dp/0996983892","https://images-na.ssl-images-amazon.com/images/S/compressed.photo.goodreads.com/books/1328831036i/840.jpg",intermediate,"product management, e-learning, educational content, learning outcomes, specialized","edtech, B2B, B2C","practical, case_studies"
"Product Management for HR Tech Products: A Complete Guide to HR Tech Product Management","Aswin Pranam","A specialized guide to product management for HR technology products with talent management and workforce solutions.",4.0,"https://www.amazon.com/dp/0996983906","https://images-na.ssl-images-amazon.com/images/S/compressed.photo.goodreads.com/books/1328831036i/840.jpg",intermediate,"product management, hr tech, talent management, workforce, specialized","hr tech, B2B","practical, case_studies"
"Product Management for MarTech Products: A Complete Guide to Marketing Technology Product Management","Aswin Pranam","A specialized guide to product management for marketing technology products with customer acquisition and retention tools.",4.0,"https://www.amazon.com/dp/0996983914","https://images-na.ssl-images-amazon.com/images/S/compressed.photo.goodreads.com/books/1328831036i/840.jpg",intermediate,"product management, martech, marketing technology, customer acquisition, specialized","martech, B2B","practical, case_studies"
"Product Management for SalesTech Products: A Complete Guide to Sales Technology Product Management","Aswin Pranam","A specialized guide to product management for sales technology products with CRM and sales automation tools.",4.0,"https://www.amazon.com/dp/0996983922","https://images-na.ssl-images-amazon.com/images/S/compressed.photo.goodreads.com/books/1328831036i/840.jpg",intermediate,"product management, salestech, sales technology, crm, specialized","salestech, B2B","practical, case_studies"
"Product Management for AdTech Products: A Complete Guide to Advertising Technology Product Management","Aswin Pranam","A specialized guide to product management for advertising technology products with targeting and optimization tools.",4.0,"https://www.amazon.com/dp/0996983930","https://images-na.ssl-images-amazon.com/images/S/compressed.photo.goodreads.com/books/1328831036i/840.jpg",intermediate,"product management, adtech, advertising technology, targeting, specialized","adtech, B2B","practical, case_studies"
"Product Management for RegTech Products: A Complete Guide to Regulatory Technology Product Management","Aswin Pranam","A specialized guide to product management for regulatory technology products with compliance and risk management tools.",4.0,"https://www.amazon.com/dp/0996983949","https://images-na.ssl-images-amazon.com/images/S/compressed.photo.goodreads.com/books/1328831036i/840.jpg",intermediate,"product management, regtech, regulatory technology, compliance, specialized","regtech, B2B","practical, case_studies"
"Product Management for InsurTech Products: A Complete Guide to Insurance Technology Product Management","Aswin Pranam","A specialized guide to product management for insurance technology products with risk assessment and claims processing.",4.0,"https://www.amazon.com/dp/0996983957","https://images-na.ssl-images-amazon.com/images/S/compressed.photo.goodreads.com/books/1328831036i/840.jpg",intermediate,"product management, insurtech, insurance technology, risk assessment, specialized","insurtech, B2B, B2C","practical, case_studies"
"Product Management for PropTech Products: A Complete Guide to Property Technology Product Management","Aswin Pranam","A specialized guide to product management for property technology products with real estate and property management solutions.",4.0,"https://www.amazon.com/dp/0996983965","https://images-na.ssl-images-amazon.com/images/S/compressed.photo.goodreads.com/books/1328831036i/840.jpg",intermediate,"product management, proptech, property technology, real estate, specialized","proptech, B2B, B2C","practical, case_studies"
"Product Management for LegalTech Products: A Complete Guide to Legal Technology Product Management","Aswin Pranam","A specialized guide to product management for legal technology products with case management and legal research tools.",4.0,"https://www.amazon.com/dp/0996983973","https://images-na.ssl-images-amazon.com/images/S/compressed.photo.goodreads.com/books/1328831036i/840.jpg",intermediate,"product management, legaltech, legal technology, case management, specialized","legaltech, B2B","practical, case_studies"
"Product Management for GovTech Products: A Complete Guide to Government Technology Product Management","Aswin Pranam","A specialized guide to product management for government technology products with public sector and civic solutions.",4.0,"https://www.amazon.com/dp/0996983981","https://images-na.ssl-images-amazon.com/images/S/compressed.photo.goodreads.com/books/1328831036i/840.jpg",intermediate,"product management, govtech, government technology, public sector, specialized","govtech, B2G","practical, case_studies"
"Product Management for EdTech Products: A Complete Guide to Education Technology Product Management","Aswin Pranam","A specialized guide to product management for education technology products with learning management and student engagement tools.",4.0,"https://www.amazon.com/dp/099698399X","https://images-na.ssl-images-amazon.com/images/S/compressed.photo.goodreads.com/books/1328831036i/840.jpg",intermediate,"product management, edtech, education technology, learning management, specialized","edtech, B2B, B2C","practical, case_studies"
"Product Management for HealthTech Products: A Complete Guide to Health Technology Product Management","Aswin Pranam","A specialized guide to product management for health technology products with patient care and medical device solutions.",4.0,"https://www.amazon.com/dp/0996984007","https://images-na.ssl-images-amazon.com/images/S/compressed.photo.goodreads.com/books/1328831036i/840.jpg",intermediate,"product management, healthtech, health technology, patient care, specialized","healthtech, B2B, B2C","practical, case_studies"
"Product Management for CleanTech Products: A Complete Guide to Clean Technology Product Management","Aswin Pranam","A specialized guide to product management for clean technology products with sustainability and environmental solutions.",4.0,"https://www.amazon.com/dp/0996984015","https://images-na.ssl-images-amazon.com/images/S/compressed.photo.goodreads.com/books/1328831036i/840.jpg",intermediate,"product management, cleantech, clean technology, sustainability, specialized","cleantech, B2B, B2C","practical, case_studies"
"Product Management for CyberTech Products: A Complete Guide to Cybersecurity Technology Product Management","Aswin Pranam","A specialized guide to product management for cybersecurity technology products with threat detection and security solutions.",4.0,"https://www.amazon.com/dp/0996984023","https://images-na.ssl-images-amazon.com/images/S/compressed.photo.goodreads.com/books/1328831036i/840.jpg",intermediate,"product management, cybertech, cybersecurity, threat detection, specialized","cybertech, B2B","practical, case_studies"
"Product Management for BioTech Products: A Complete Guide to Biotechnology Product Management","Aswin Pranam","A specialized guide to product management for biotechnology products with research and development considerations.",4.0,"https://www.amazon.com/dp/0996984031","https://images-na.ssl-images-amazon.com/images/S/compressed.photo.goodreads.com/books/1328831036i/840.jpg",advanced,"product management, biotech, biotechnology, research, specialized","biotech, B2B","practical, technical"
"Product Management for NanoTech Products: A Complete Guide to Nanotechnology Product Management","Aswin Pranam","A specialized guide to product management for nanotechnology products with advanced materials and manufacturing considerations.",4.0,"https://www.amazon.com/dp/099698404X","https://images-na.ssl-images-amazon.com/images/S/compressed.photo.goodreads.com/books/1328831036i/840.jpg",advanced,"product management, nanotech, nanotechnology, advanced materials, specialized","nanotech, B2B","practical, technical"
"Product Management for SpaceTech Products: A Complete Guide to Space Technology Product Management","Aswin Pranam","A specialized guide to product management for space technology products with aerospace and satellite solutions.",4.0,"https://www.amazon.com/dp/0996984058","https://images-na.ssl-images-amazon.com/images/S/compressed.photo.goodreads.com/books/1328831036i/840.jpg",advanced,"product management, spacetech, space technology, aerospace, specialized","spacetech, B2B","practical, technical"
