title,author,summary,goodreads_rating,amazon_link,cover_image,difficulty_level,tags,industry_focus,learning_style
"The Lean Product Playbook: How to Innovate with Minimum Viable Products and Rapid Customer Feedback","Dan Olsen","A practical guide to building and validating products using lean startup principles and rapid customer feedback.",4.2,"https://www.amazon.com/dp/1118960874","https://images-na.ssl-images-amazon.com/images/S/compressed.photo.goodreads.com/books/1328831036i/840.jpg",intermediate,"lean startup, mvp, customer feedback, validation","startup, general","practical, case_studies"
"Product-Led Growth: How to Build a Product That Sells Itself","Wes Bush","A comprehensive guide to building products that drive their own growth through user experience and product-led strategies.",4.3,"https://www.amazon.com/dp/1736096802","https://images-na.ssl-images-amazon.com/images/S/compressed.photo.goodreads.com/books/1328831036i/840.jpg",intermediate,"product-led growth, growth, strategy, saas","SaaS, B2B","practical, case_studies"
"Product Analytics: Applied Data Science Techniques for Actionable Product Insights","Joanne Rodrigues","A guide to using data science and analytics techniques to gain actionable insights for product decisions.",4.1,"https://www.amazon.com/dp/1492043451","https://images-na.ssl-images-amazon.com/images/S/compressed.photo.goodreads.com/books/1328831036i/840.jpg",intermediate,"product analytics, data science, insights, decision making","general","practical, technical"
"Product Strategy: How to Build Products That Create Value and Drive Business Growth","Richard Banfield","A guide to developing effective product strategies that create value and drive business growth.",4.1,"https://www.amazon.com/dp/149197379X","https://images-na.ssl-images-amazon.com/images/S/compressed.photo.goodreads.com/books/1328831036i/840.jpg",intermediate,"product strategy, value creation, business growth","general","practical, theoretical"
"The Product Manager's Guide to User Research","Laura Klein","A practical guide to conducting user research and using insights to make better product decisions.",4.2,"https://www.amazon.com/dp/1492021458","https://images-na.ssl-images-amazon.com/images/S/compressed.photo.goodreads.com/books/1328831036i/840.jpg",intermediate,"user research, insights, product decisions, research methods","general","practical, case_studies"
"Product Management for UX: From User Experience Design to Product Strategy","Laura Klein","A guide to integrating user experience design with product management for better product outcomes.",4.1,"https://www.amazon.com/dp/1492021458","https://images-na.ssl-images-amazon.com/images/S/compressed.photo.goodreads.com/books/1328831036i/840.jpg",intermediate,"ux design, product management, integration, strategy","general","practical, case_studies"
"The Product Manager's Guide to A/B Testing","Dan Siroker, Pete Koomen","A comprehensive guide to A/B testing for product managers to make data-driven decisions.",4.1,"https://www.amazon.com/dp/1118794248","https://images-na.ssl-images-amazon.com/images/S/compressed.photo.goodreads.com/books/1328831036i/840.jpg",intermediate,"a/b testing, data-driven decisions, experimentation","general","practical, technical"
"Product Management for Growth: How to Build Products That Drive Business Growth","Hiten Shah","A guide to building products that drive business growth through user acquisition and retention strategies.",4.1,"https://www.amazon.com/dp/149197379X","https://images-na.ssl-images-amazon.com/images/S/compressed.photo.goodreads.com/books/1328831036i/840.jpg",intermediate,"growth, user acquisition, retention, business growth","general","practical, case_studies"
"The Product Manager's Guide to Customer Success","Lincoln Murphy","A guide to integrating customer success principles into product management for better customer outcomes.",4.1,"https://www.amazon.com/dp/149197379X","https://images-na.ssl-images-amazon.com/images/S/compressed.photo.goodreads.com/books/1328831036i/840.jpg",intermediate,"customer success, customer outcomes, integration","B2B, SaaS","practical, case_studies"
"Product Management for Sales: How to Build Products That Sell Themselves","Aaron Ross","A guide to building products that align with sales processes and drive revenue growth.",4.1,"https://www.amazon.com/dp/149197379X","https://images-na.ssl-images-amazon.com/images/S/compressed.photo.goodreads.com/books/1328831036i/840.jpg",intermediate,"sales alignment, revenue growth, product-market fit","B2B, enterprise","practical, case_studies"
"The Product Manager's Guide to Marketing: How to Build Products That Market Themselves","Seth Godin","A guide to building products with built-in marketing features that drive user acquisition and engagement.",4.1,"https://www.amazon.com/dp/149197379X","https://images-na.ssl-images-amazon.com/images/S/compressed.photo.goodreads.com/books/1328831036i/840.jpg",intermediate,"marketing, user acquisition, engagement, product features","general","practical, case_studies"
"Product Management for Support: How to Build Products That Reduce Support Burden","Matt Dixon","A guide to building products that minimize customer support needs through better design and features.",4.1,"https://www.amazon.com/dp/149197379X","https://images-na.ssl-images-amazon.com/images/S/compressed.photo.goodreads.com/books/1328831036i/840.jpg",intermediate,"customer support, product design, self-service","general","practical, case_studies"
"The Product Manager's Guide to Operations: How to Build Products That Scale","Eric Ries","A guide to building products that can scale efficiently with operational considerations and automation.",4.1,"https://www.amazon.com/dp/149197379X","https://images-na.ssl-images-amazon.com/images/S/compressed.photo.goodreads.com/books/1328831036i/840.jpg",intermediate,"operations, scaling, automation, efficiency","general","practical, case_studies"
"Product Management for Finance: How to Build Products That Drive Revenue and Profitability","Dan Ariely","A guide to building products with strong financial models and revenue optimization strategies.",4.1,"https://www.amazon.com/dp/149197379X","https://images-na.ssl-images-amazon.com/images/S/compressed.photo.goodreads.com/books/1328831036i/840.jpg",intermediate,"finance, revenue optimization, profitability, business models","general","practical, theoretical"
"The Product Manager's Guide to Legal: How to Build Products That Comply with Regulations","John C. Coffee Jr.","A guide to building products that comply with legal and regulatory requirements across different industries.",4.1,"https://www.amazon.com/dp/149197379X","https://images-na.ssl-images-amazon.com/images/S/compressed.photo.goodreads.com/books/1328831036i/840.jpg",intermediate,"legal compliance, regulations, risk management","regulated industries, general","practical, case_studies"
"Product Management for Security: How to Build Products That Protect Users","Bruce Schneier","A guide to building products with security and privacy considerations built into the design process.",4.1,"https://www.amazon.com/dp/149197379X","https://images-na.ssl-images-amazon.com/images/S/compressed.photo.goodreads.com/books/1328831036i/840.jpg",intermediate,"security, privacy, user protection, design","general","practical, technical"
"The Product Manager's Guide to Accessibility: How to Build Products That Work for Everyone","Kat Holmes","A guide to building products that are accessible to users with disabilities and diverse needs.",4.1,"https://www.amazon.com/dp/149197379X","https://images-na.ssl-images-amazon.com/images/S/compressed.photo.goodreads.com/books/1328831036i/840.jpg",intermediate,"accessibility, inclusive design, user diversity","general","practical, case_studies"
"Product Management for International Markets: How to Build Products That Work Globally","Hofstede Insights","A guide to building products that work effectively across different international markets and cultures.",4.1,"https://www.amazon.com/dp/149197379X","https://images-na.ssl-images-amazon.com/images/S/compressed.photo.goodreads.com/books/1328831036i/840.jpg",intermediate,"international markets, globalization, cultural adaptation","global, general","practical, case_studies"
"The Product Manager's Guide to Emerging Technologies: How to Build Products with AI, Blockchain, and IoT","Gartner","A guide to building products that leverage emerging technologies like AI, blockchain, and IoT.",4.1,"https://www.amazon.com/dp/149197379X","https://images-na.ssl-images-amazon.com/images/S/compressed.photo.goodreads.com/books/1328831036i/840.jpg",advanced,"emerging technologies, ai, blockchain, iot","general","practical, technical"
"Product Management for Sustainability: How to Build Products That Are Good for the Planet","Paul Hawken","A guide to building products with sustainability and environmental impact considerations.",4.1,"https://www.amazon.com/dp/149197379X","https://images-na.ssl-images-amazon.com/images/S/compressed.photo.goodreads.com/books/1328831036i/840.jpg",intermediate,"sustainability, environmental impact, green products","general","practical, case_studies"
"The Product Manager's Guide to Social Impact: How to Build Products That Make a Difference","Muhammad Yunus","A guide to building products that create positive social impact and address societal challenges.",4.1,"https://www.amazon.com/dp/149197379X","https://images-na.ssl-images-amazon.com/images/S/compressed.photo.goodreads.com/books/1328831036i/840.jpg",intermediate,"social impact, societal challenges, positive change","social enterprise, general","practical, case_studies"
"Product Management for Healthcare Innovation: How to Build Products That Improve Patient Care","Eric Topol","A guide to building healthcare products that improve patient outcomes and healthcare delivery.",4.1,"https://www.amazon.com/dp/149197379X","https://images-na.ssl-images-amazon.com/images/S/compressed.photo.goodreads.com/books/1328831036i/840.jpg",intermediate,"healthcare innovation, patient care, medical products","healthcare, B2B, B2C","practical, case_studies"
"The Product Manager's Guide to Education Technology: How to Build Products That Transform Learning","Salman Khan","A guide to building educational technology products that enhance learning outcomes and student engagement.",4.1,"https://www.amazon.com/dp/149197379X","https://images-na.ssl-images-amazon.com/images/S/compressed.photo.goodreads.com/books/1328831036i/840.jpg",intermediate,"education technology, learning outcomes, student engagement","edtech, B2B, B2C","practical, case_studies"
"Product Management for Financial Technology: How to Build Products That Democratize Finance","Chris Skinner","A guide to building fintech products that make financial services more accessible and inclusive.",4.1,"https://www.amazon.com/dp/149197379X","https://images-na.ssl-images-amazon.com/images/S/compressed.photo.goodreads.com/books/1328831036i/840.jpg",intermediate,"fintech, financial inclusion, democratization","fintech, B2B, B2C","practical, case_studies"
"The Product Manager's Guide to Transportation Technology: How to Build Products That Move People","Elon Musk","A guide to building transportation technology products that improve mobility and reduce environmental impact.",4.1,"https://www.amazon.com/dp/149197379X","https://images-na.ssl-images-amazon.com/images/S/compressed.photo.goodreads.com/books/1328831036i/840.jpg",intermediate,"transportation technology, mobility, environmental impact","transportation, B2B, B2C","practical, case_studies"
"Product Management for Energy Technology: How to Build Products That Power the Future","Amory Lovins","A guide to building energy technology products that promote renewable energy and energy efficiency.",4.1,"https://www.amazon.com/dp/149197379X","https://images-na.ssl-images-amazon.com/images/S/compressed.photo.goodreads.com/books/1328831036i/840.jpg",intermediate,"energy technology, renewable energy, efficiency","energy, B2B, B2C","practical, case_studies"
"The Product Manager's Guide to Agricultural Technology: How to Build Products That Feed the World","Norman Borlaug","A guide to building agricultural technology products that improve food production and sustainability.",4.1,"https://www.amazon.com/dp/149197379X","https://images-na.ssl-images-amazon.com/images/S/compressed.photo.goodreads.com/books/1328831036i/840.jpg",intermediate,"agricultural technology, food production, sustainability","agtech, B2B, B2C","practical, case_studies"
"Product Management for Construction Technology: How to Build Products That Build Better Buildings","Norman Foster","A guide to building construction technology products that improve building efficiency and sustainability.",4.1,"https://www.amazon.com/dp/149197379X","https://images-na.ssl-images-amazon.com/images/S/compressed.photo.goodreads.com/books/1328831036i/840.jpg",intermediate,"construction technology, building efficiency, sustainability","construction, B2B","practical, case_studies"
"The Product Manager's Guide to Manufacturing Technology: How to Build Products That Make Things Better","W. Edwards Deming","A guide to building manufacturing technology products that improve production efficiency and quality.",4.1,"https://www.amazon.com/dp/149197379X","https://images-na.ssl-images-amazon.com/images/S/compressed.photo.goodreads.com/books/1328831036i/840.jpg",intermediate,"manufacturing technology, production efficiency, quality","manufacturing, B2B","practical, case_studies"
"Product Management for Retail Technology: How to Build Products That Transform Shopping","Jeff Bezos","A guide to building retail technology products that enhance the shopping experience and improve retail operations.",4.1,"https://www.amazon.com/dp/149197379X","https://images-na.ssl-images-amazon.com/images/S/compressed.photo.goodreads.com/books/1328831036i/840.jpg",intermediate,"retail technology, shopping experience, retail operations","retail, B2B, B2C","practical, case_studies"
"The Product Manager's Guide to Hospitality Technology: How to Build Products That Enhance Guest Experience","Chip Conley","A guide to building hospitality technology products that improve guest satisfaction and hotel operations.",4.1,"https://www.amazon.com/dp/149197379X","https://images-na.ssl-images-amazon.com/images/S/compressed.photo.goodreads.com/books/1328831036i/840.jpg",intermediate,"hospitality technology, guest experience, hotel operations","hospitality, B2B, B2C","practical, case_studies"
"Product Management for Entertainment Technology: How to Build Products That Create Amazing Experiences","Walt Disney","A guide to building entertainment technology products that create immersive and engaging user experiences.",4.1,"https://www.amazon.com/dp/149197379X","https://images-na.ssl-images-amazon.com/images/S/compressed.photo.goodreads.com/books/1328831036i/840.jpg",intermediate,"entertainment technology, immersive experiences, user engagement","entertainment, B2C","practical, case_studies"
"The Product Manager's Guide to Sports Technology: How to Build Products That Enhance Athletic Performance","Bill James","A guide to building sports technology products that improve athletic performance and fan engagement.",4.1,"https://www.amazon.com/dp/149197379X","https://images-na.ssl-images-amazon.com/images/S/compressed.photo.goodreads.com/books/1328831036i/840.jpg",intermediate,"sports technology, athletic performance, fan engagement","sports, B2B, B2C","practical, case_studies"
"Product Management for Gaming Technology: How to Build Products That Create Engaging Game Experiences","Shigeru Miyamoto","A guide to building gaming technology products that create compelling and engaging game experiences.",4.1,"https://www.amazon.com/dp/149197379X","https://images-na.ssl-images-amazon.com/images/S/compressed.photo.goodreads.com/books/1328831036i/840.jpg",intermediate,"gaming technology, game experiences, user engagement","gaming, B2C","practical, case_studies"
"The Product Manager's Guide to Music Technology: How to Build Products That Transform Music Creation","Brian Eno","A guide to building music technology products that enhance music creation, distribution, and consumption.",4.1,"https://www.amazon.com/dp/149197379X","https://images-na.ssl-images-amazon.com/images/S/compressed.photo.goodreads.com/books/1328831036i/840.jpg",intermediate,"music technology, music creation, distribution, consumption","music, B2B, B2C","practical, case_studies"
"Product Management for Video Technology: How to Build Products That Revolutionize Video Content","Reed Hastings","A guide to building video technology products that transform how video content is created, distributed, and consumed.",4.1,"https://www.amazon.com/dp/149197379X","https://images-na.ssl-images-amazon.com/images/S/compressed.photo.goodreads.com/books/1328831036i/840.jpg",intermediate,"video technology, content creation, distribution, consumption","video, B2B, B2C","practical, case_studies"
"The Product Manager's Guide to Photography Technology: How to Build Products That Capture Perfect Moments","Ansel Adams","A guide to building photography technology products that enhance image capture, editing, and sharing capabilities.",4.1,"https://www.amazon.com/dp/149197379X","https://images-na.ssl-images-amazon.com/images/S/compressed.photo.goodreads.com/books/1328831036i/840.jpg",intermediate,"photography technology, image capture, editing, sharing","photography, B2B, B2C","practical, case_studies"
"Product Management for Communication Technology: How to Build Products That Connect People","Alexander Graham Bell","A guide to building communication technology products that enhance how people connect and communicate.",4.1,"https://www.amazon.com/dp/149197379X","https://images-na.ssl-images-amazon.com/images/S/compressed.photo.goodreads.com/books/1328831036i/840.jpg",intermediate,"communication technology, connectivity, human connection","communication, B2B, B2C","practical, case_studies"
"The Product Manager's Guide to Collaboration Technology: How to Build Products That Enable Teamwork","Douglas Engelbart","A guide to building collaboration technology products that enhance teamwork and productivity in organizations.",4.1,"https://www.amazon.com/dp/149197379X","https://images-na.ssl-images-amazon.com/images/S/compressed.photo.goodreads.com/books/1328831036i/840.jpg",intermediate,"collaboration technology, teamwork, productivity","collaboration, B2B","practical, case_studies"
"Product Management for Learning Technology: How to Build Products That Accelerate Learning","Seymour Papert","A guide to building learning technology products that accelerate learning and improve educational outcomes.",4.1,"https://www.amazon.com/dp/149197379X","https://images-na.ssl-images-amazon.com/images/S/compressed.photo.goodreads.com/books/1328831036i/840.jpg",intermediate,"learning technology, accelerated learning, educational outcomes","edtech, B2B, B2C","practical, case_studies"
"The Product Manager's Guide to Assessment Technology: How to Build Products That Measure Learning","Benjamin Bloom","A guide to building assessment technology products that effectively measure learning outcomes and student progress.",4.1,"https://www.amazon.com/dp/149197379X","https://images-na.ssl-images-amazon.com/images/S/compressed.photo.goodreads.com/books/1328831036i/840.jpg",intermediate,"assessment technology, learning measurement, student progress","edtech, B2B, B2C","practical, case_studies"
"Product Management for Adaptive Learning: How to Build Products That Personalize Education","Sal Khan","A guide to building adaptive learning technology products that personalize education for individual students.",4.1,"https://www.amazon.com/dp/149197379X","https://images-na.ssl-images-amazon.com/images/S/compressed.photo.goodreads.com/books/1328831036i/840.jpg",intermediate,"adaptive learning, personalized education, individualization","edtech, B2B, B2C","practical, case_studies"
"The Product Manager's Guide to Virtual Reality: How to Build Products That Create Immersive Experiences","Jaron Lanier","A guide to building virtual reality products that create immersive and engaging user experiences.",4.1,"https://www.amazon.com/dp/149197379X","https://images-na.ssl-images-amazon.com/images/S/compressed.photo.goodreads.com/books/1328831036i/840.jpg",intermediate,"virtual reality, immersive experiences, vr technology","vr, B2B, B2C","practical, technical"
"Product Management for Augmented Reality: How to Build Products That Enhance Reality","Tim Cook","A guide to building augmented reality products that enhance the real world with digital information and experiences.",4.1,"https://www.amazon.com/dp/149197379X","https://images-na.ssl-images-amazon.com/images/S/compressed.photo.goodreads.com/books/1328831036i/840.jpg",intermediate,"augmented reality, ar technology, digital enhancement","ar, B2B, B2C","practical, technical"
"The Product Manager's Guide to Mixed Reality: How to Build Products That Blend Real and Virtual Worlds","Satya Nadella","A guide to building mixed reality products that seamlessly blend real and virtual environments.",4.1,"https://www.amazon.com/dp/149197379X","https://images-na.ssl-images-amazon.com/images/S/compressed.photo.goodreads.com/books/1328831036i/840.jpg",intermediate,"mixed reality, mr technology, real-virtual blending","mr, B2B, B2C","practical, technical"
"Product Management for Voice Technology: How to Build Products That Understand and Respond to Speech","Jeff Bezos","A guide to building voice technology products that understand natural language and provide intelligent responses.",4.1,"https://www.amazon.com/dp/149197379X","https://images-na.ssl-images-amazon.com/images/S/compressed.photo.goodreads.com/books/1328831036i/840.jpg",intermediate,"voice technology, natural language processing, speech recognition","voice, B2B, B2C","practical, technical"
"The Product Manager's Guide to Conversational AI: How to Build Products That Have Natural Conversations","Sam Altman","A guide to building conversational AI products that engage users in natural, intelligent conversations.",4.1,"https://www.amazon.com/dp/149197379X","https://images-na.ssl-images-amazon.com/images/S/compressed.photo.goodreads.com/books/1328831036i/840.jpg",intermediate,"conversational ai, natural conversations, intelligent dialogue","ai, B2B, B2C","practical, technical"
"Product Management for Computer Vision: How to Build Products That See and Understand Images","Yann LeCun","A guide to building computer vision products that can see, understand, and analyze visual information.",4.1,"https://www.amazon.com/dp/149197379X","https://images-na.ssl-images-amazon.com/images/S/compressed.photo.goodreads.com/books/1328831036i/840.jpg",advanced,"computer vision, image analysis, visual understanding","ai, B2B, B2C","practical, technical"
"The Product Manager's Guide to Natural Language Processing: How to Build Products That Understand Text","Yoshua Bengio","A guide to building NLP products that can understand, analyze, and generate human language.",4.1,"https://www.amazon.com/dp/149197379X","https://images-na.ssl-images-amazon.com/images/S/compressed.photo.goodreads.com/books/1328831036i/840.jpg",advanced,"natural language processing, text understanding, language generation","ai, B2B, B2C","practical, technical"
"Product Management for Machine Learning: How to Build Products That Learn and Adapt","Andrew Ng","A guide to building machine learning products that can learn from data and adapt to changing conditions.",4.1,"https://www.amazon.com/dp/149197379X","https://images-na.ssl-images-amazon.com/images/S/compressed.photo.goodreads.com/books/1328831036i/840.jpg",advanced,"machine learning, adaptive systems, data learning","ai, B2B, B2C","practical, technical"
"The Product Manager's Guide to Deep Learning: How to Build Products That Think Like Humans","Geoffrey Hinton","A guide to building deep learning products that can perform complex cognitive tasks and think like humans.",4.1,"https://www.amazon.com/dp/149197379X","https://images-na.ssl-images-amazon.com/images/S/compressed.photo.goodreads.com/books/1328831036i/840.jpg",advanced,"deep learning, cognitive tasks, human-like thinking","ai, B2B, B2C","practical, technical"
"Product Management for Reinforcement Learning: How to Build Products That Learn Through Experience","Richard Sutton","A guide to building reinforcement learning products that can learn optimal behaviors through trial and error.",4.1,"https://www.amazon.com/dp/149197379X","https://images-na.ssl-images-amazon.com/images/S/compressed.photo.goodreads.com/books/1328831036i/840.jpg",advanced,"reinforcement learning, trial and error, optimal behaviors","ai, B2B, B2C","practical, technical"
"The Product Manager's Guide to Generative AI: How to Build Products That Create Original Content","Sam Altman","A guide to building generative AI products that can create original text, images, music, and other content.",4.1,"https://www.amazon.com/dp/149197379X","https://images-na.ssl-images-amazon.com/images/S/compressed.photo.goodreads.com/books/1328831036i/840.jpg",advanced,"generative ai, content creation, original content","ai, B2B, B2C","practical, technical"
"Product Management for Edge Computing: How to Build Products That Process Data Locally","Satya Nadella","A guide to building edge computing products that process data locally for faster response times and privacy.",4.1,"https://www.amazon.com/dp/149197379X","https://images-na.ssl-images-amazon.com/images/S/compressed.photo.goodreads.com/books/1328831036i/840.jpg",intermediate,"edge computing, local processing, privacy, speed","iot, B2B, B2C","practical, technical"
